{
  "schemaVersion": "1.0.0",
  "sourceSpec": {
    "schemaVersion": "0.1.0",
    "title": "Add dark mode support",
    "description": "Implement theme switcher with light/dark modes",
    "acceptanceCriteria": [
      "User can toggle between light and dark themes",
      "Theme preference persists across sessions",
      "All UI components support both themes"
    ],
    "technicalContext": "Use CSS variables and localStorage",
    "constraints": "Must work in IE11+",
    "repo": "owner/repo",
    "createdAt": "2025-11-09T14:30:00.000Z"
  },
  "epic": {
    "title": "Add dark mode support",
    "description": "Implement theme switcher with light/dark modes",
    "acceptanceCriteria": [
      "User can toggle between light and dark themes",
      "Theme preference persists across sessions",
      "All UI components support both themes"
    ]
  },
  "subIssues": [
    {
      "id": "feature-impl",
      "title": "Implement Add dark mode support",
      "description": "Core implementation of feature",
      "type": "feature",
      "acceptanceCriteria": [
        "User can toggle between light and dark themes",
        "Theme preference persists across sessions",
        "All UI components support both themes"
      ],
      "dependsOn": []
    },
    {
      "id": "tests",
      "title": "Add tests for Add dark mode support",
      "description": "Unit and integration tests",
      "type": "testing",
      "acceptanceCriteria": [
        "Unit tests pass",
        "Integration tests pass",
        "Coverage > 80%"
      ],
      "dependsOn": ["feature-impl"]
    },
    {
      "id": "docs",
      "title": "Document Add dark mode support",
      "description": "User-facing documentation",
      "type": "docs",
      "acceptanceCriteria": [
        "README updated",
        "Examples added",
        "API docs complete"
      ],
      "dependsOn": ["feature-impl"]
    }
  ],
  "createdAt": "2025-11-09T14:35:00.000Z"
}
